{"schema_version":"apex-iracing-variable-inventory/1.0.0","values_sampled":false,"direct_identifiers_included":false,"variables":[{"name":"AirDensity","sdk_type":"Float","count":1,"unit":"kg/m^3","description":"Density of air at start/finish line"},{"name":"AirPressure","sdk_type":"Float","count":1,"unit":"Pa","description":"Pressure of air at start/finish line"},{"name":"AirTemp","sdk_type":"Float","count":1,"unit":"C","description":"Temperature of air at start/finish line"},{"name":"Brake","sdk_type":"Float","count":1,"unit":"%","description":"0=brake released to 1=max pedal force"},{"name":"BrakeABSactive","sdk_type":"Bool","count":1,"unit":null,"description":"true if abs is currently reducing brake force pressure"},{"name":"BrakeRaw","sdk_type":"Float","count":1,"unit":"%","description":"Raw brake input 0=brake released to 1=max pedal force"},{"name":"CamCameraNumber","sdk_type":"Int","count":1,"unit":null,"description":"Active camera number"},{"name":"CamCameraState","sdk_type":"BitField","count":1,"unit":"irsdk_CameraState","description":"State of camera system"},{"name":"CamCarIdx","sdk_type":"Int","count":1,"unit":null,"description":"Active camera\u0027s focus car index"},{"name":"CamGroupNumber","sdk_type":"Int","count":1,"unit":null,"description":"Active camera group number"},{"name":"CarDistAhead","sdk_type":"Float","count":1,"unit":"m","description":"Distance to first car in front of player in meters"},{"name":"CarDistBehind","sdk_type":"Float","count":1,"unit":"m","description":"Distance to first car behind player in meters"},{"name":"CarIdxBestLapNum","sdk_type":"Int","count":72,"unit":null,"description":"Cars best lap number"},{"name":"CarIdxBestLapTime","sdk_type":"Float","count":72,"unit":"s","description":"Cars best lap time"},{"name":"CarIdxClass","sdk_type":"Int","count":72,"unit":null,"description":"Cars class id by car index"},{"name":"CarIdxClassPosition","sdk_type":"Int","count":72,"unit":null,"description":"Cars class position in race by car index"},{"name":"CarIdxEstTime","sdk_type":"Float","count":72,"unit":"s","description":"Estimated time to reach current location on track"},{"name":"CarIdxF2Time","sdk_type":"Float","count":72,"unit":"s","description":"Race time behind leader or fastest lap time otherwise"},{"name":"CarIdxFastRepairsUsed","sdk_type":"Int","count":72,"unit":null,"description":"How many fast repairs each car has used"},{"name":"CarIdxGear","sdk_type":"Int","count":72,"unit":null,"description":"-1=reverse  0=neutral  1..n=current gear by car index"},{"name":"CarIdxLap","sdk_type":"Int","count":72,"unit":null,"description":"Laps started by car index"},{"name":"CarIdxLapCompleted","sdk_type":"Int","count":72,"unit":null,"description":"Laps completed by car index"},{"name":"CarIdxLapDistPct","sdk_type":"Float","count":72,"unit":"%","description":"Percentage distance around lap by car index"},{"name":"CarIdxLastLapTime","sdk_type":"Float","count":72,"unit":"s","description":"Cars last lap time"},{"name":"CarIdxOnPitRoad","sdk_type":"Bool","count":72,"unit":null,"description":"On pit road between the cones by car index"},{"name":"CarIdxP2P_Count","sdk_type":"Int","count":72,"unit":null,"description":"Push2Pass count of usage (or remaining in Race)"},{"name":"CarIdxP2P_Status","sdk_type":"Bool","count":72,"unit":null,"description":"Push2Pass active or not"},{"name":"CarIdxPaceFlags","sdk_type":"BitField","count":72,"unit":"irsdk_PaceFlags","description":"Pacing status flags for each car"},{"name":"CarIdxPaceLine","sdk_type":"Int","count":72,"unit":null,"description":"What line cars are pacing in  or -1 if not pacing"},{"name":"CarIdxPaceRow","sdk_type":"Int","count":72,"unit":null,"description":"What row cars are pacing in  or -1 if not pacing"},{"name":"CarIdxPosition","sdk_type":"Int","count":72,"unit":null,"description":"Cars position in race by car index"},{"name":"CarIdxQualTireCompound","sdk_type":"Int","count":72,"unit":null,"description":"Cars Qual tire compound"},{"name":"CarIdxQualTireCompoundLocked","sdk_type":"Bool","count":72,"unit":null,"description":"Cars Qual tire compound is locked-in"},{"name":"CarIdxRPM","sdk_type":"Float","count":72,"unit":"revs/min","description":"Engine rpm by car index"},{"name":"CarIdxSessionFlags","sdk_type":"BitField","count":72,"unit":"irsdk_Flags","description":"Session flags for each player"},{"name":"CarIdxSteer","sdk_type":"Float","count":72,"unit":"rad","description":"Steering wheel angle by car index"},{"name":"CarIdxTireCompound","sdk_type":"Int","count":72,"unit":null,"description":"Cars current tire compound"},{"name":"CarIdxTrackSurface","sdk_type":"Int","count":72,"unit":"irsdk_TrkLoc","description":"Track surface type by car index"},{"name":"CarIdxTrackSurfaceMaterial","sdk_type":"Int","count":72,"unit":"irsdk_TrkSurf","description":"Track surface material type by car index"},{"name":"CarLeftRight","sdk_type":"Int","count":1,"unit":"irsdk_CarLeftRight","description":"Notify if car is to the left or right of driver"},{"name":"ChanAvgLatency","sdk_type":"Float","count":1,"unit":"s","description":"Communications average latency"},{"name":"ChanClockSkew","sdk_type":"Float","count":1,"unit":"s","description":"Communications server clock skew"},{"name":"ChanLatency","sdk_type":"Float","count":1,"unit":"s","description":"Communications latency"},{"name":"ChanPartnerQuality","sdk_type":"Float","count":1,"unit":"%","description":"Partner communications quality"},{"name":"ChanQuality","sdk_type":"Float","count":1,"unit":"%","description":"Communications quality"},{"name":"Clutch","sdk_type":"Float","count":1,"unit":"%","description":"0=disengaged to 1=fully engaged"},{"name":"ClutchRaw","sdk_type":"Float","count":1,"unit":"%","description":"Raw clutch input 0=disengaged to 1=fully engaged"},{"name":"CpuUsageBG","sdk_type":"Float","count":1,"unit":"%","description":"Percent of available time bg thread took with a 1 sec avg"},{"name":"CpuUsageFG","sdk_type":"Float","count":1,"unit":"%","description":"Percent of available time fg thread took with a 1 sec avg"},{"name":"DCDriversSoFar","sdk_type":"Int","count":1,"unit":null,"description":"Number of team drivers who have run a stint"},{"name":"DCLapStatus","sdk_type":"Int","count":1,"unit":null,"description":"Status of driver change lap requirements"},{"name":"DisplayUnits","sdk_type":"Int","count":1,"unit":null,"description":"Default units for the user interface 0 = english 1 = metric"},{"name":"DriverMarker","sdk_type":"Bool","count":1,"unit":null,"description":"Driver activated flag"},{"name":"Engine0_RPM","sdk_type":"Float","count":1,"unit":"revs/min","description":"Engine0Engine rpm"},{"name":"EngineWarnings","sdk_type":"BitField","count":1,"unit":"irsdk_EngineWarnings","description":"Bitfield for warning lights"},{"name":"EnterExitReset","sdk_type":"Int","count":1,"unit":null,"description":"Indicate action the reset key will take 0 enter 1 exit 2 reset"},{"name":"FastRepairAvailable","sdk_type":"Int","count":1,"unit":null,"description":"How many fast repairs left  255 is unlimited"},{"name":"FastRepairUsed","sdk_type":"Int","count":1,"unit":null,"description":"How many fast repairs used so far"},{"name":"FogLevel","sdk_type":"Float","count":1,"unit":"%","description":"Fog level at start/finish line"},{"name":"FrameRate","sdk_type":"Float","count":1,"unit":"fps","description":"Average frames per second"},{"name":"FrontTireSetsAvailable","sdk_type":"Int","count":1,"unit":null,"description":"How many front tire sets are remaining  255 is unlimited"},{"name":"FrontTireSetsUsed","sdk_type":"Int","count":1,"unit":null,"description":"How many front tire sets used so far"},{"name":"FuelLevel","sdk_type":"Float","count":1,"unit":"l","description":"Liters of fuel remaining"},{"name":"FuelLevelPct","sdk_type":"Float","count":1,"unit":"%","description":"Percent fuel remaining"},{"name":"FuelPress","sdk_type":"Float","count":1,"unit":"bar","description":"Engine fuel pressure"},{"name":"FuelUsePerHour","sdk_type":"Float","count":1,"unit":"kg/h","description":"Engine fuel used instantaneous"},{"name":"Gear","sdk_type":"Int","count":1,"unit":null,"description":"-1=reverse  0=neutral  1..n=current gear"},{"name":"GpuUsage","sdk_type":"Float","count":1,"unit":"%","description":"Percent of available time gpu took with a 1 sec avg"},{"name":"HandbrakeRaw","sdk_type":"Float","count":1,"unit":"%","description":"Raw handbrake input 0=handbrake released to 1=max force"},{"name":"IsDiskLoggingActive","sdk_type":"Bool","count":1,"unit":null,"description":"0=disk based telemetry file not being written  1=being written"},{"name":"IsDiskLoggingEnabled","sdk_type":"Bool","count":1,"unit":null,"description":"0=disk based telemetry turned off  1=turned on"},{"name":"IsGarageVisible","sdk_type":"Bool","count":1,"unit":null,"description":"1=Garage screen is visible"},{"name":"IsInGarage","sdk_type":"Bool","count":1,"unit":null,"description":"1=Car in garage physics running"},{"name":"IsOnTrack","sdk_type":"Bool","count":1,"unit":null,"description":"1=Car on track physics running with player in car"},{"name":"IsOnTrackCar","sdk_type":"Bool","count":1,"unit":null,"description":"1=Car on track physics running"},{"name":"IsReplayPlaying","sdk_type":"Bool","count":1,"unit":null,"description":"0=replay not playing  1=replay playing"},{"name":"LFTiresAvailable","sdk_type":"Int","count":1,"unit":null,"description":"How many left front tires are remaining  255 is unlimited"},{"name":"LFTiresUsed","sdk_type":"Int","count":1,"unit":null,"description":"How many left front tires used so far"},{"name":"LFbrakeLinePress","sdk_type":"Float","count":1,"unit":"bar","description":"LF brake line pressure"},{"name":"LFcoldPressure","sdk_type":"Float","count":1,"unit":"kPa","description":"LF tire cold pressure  as set in the garage"},{"name":"LFodometer","sdk_type":"Float","count":1,"unit":"m","description":"LF distance tire traveled since being placed on car"},{"name":"LFshockDefl","sdk_type":"Float","count":1,"unit":"m","descript